3_question/pcr_simulation.csv

# cycles,T_denat [C],t_denat [s],T_anneal [C],t_anneal [s],T_extend [C],t_extend [s],mass_dna [ng],vol_primers [uL],vol_dntp [uL],polymerase_units [U],polymerase,vol_buffer [uL],yield [ng/uL],purity [%],time [min]
15,80,10,68,10,54,20,50,1,0.5,1,Taq,10,0.1,10.5,20
15,80,10,68,10,54,20,50,1,0.5,1,Phusion,10,0.2,13.4,20
35,80,10,68,10,54,20,50,1,0.5,1,Phusion,10,1.2,34.5,33.3
5,80,10,68,10,54,20,50,1,0.5,1,Phusion,10,0,7.4,13.3
50,80,10,68,10,54,20,50,1,0.5,1,Phusion,10,3.3,52.4,43.3
15,80,10,61,10,54,20,50,1,0.5,1,Phusion,10,0.2,14.1,20
15,80,10,45,10,54,20,50,1,0.5,1,Phusion,10,0.2,12.9,20
15,80,10,79,10,54,20,50,1,0.5,1,Phusion,10,0.3,14.8,20
35,80,10,61,10,54,20,50,1,0.5,1,Phusion,10,1.3,35.7,33.3
15,80,10,61,10,72,20,50,1,0.5,1,Phusion,10,0.2,13.5,20
35,80,10,61,10,72,20,50,1,0.5,1,Phusion,10,1.2,34.2,33.3
35,80,10,61,20,72,20,50,1,0.5,1,Phusion,10,2.1,46.2,39.2
35,98,10,61,20,72,20,50,1,0.5,1,Phusion,10,95,81,39.2
35,98,10,61,10,72,20,50,1,0.5,1,Phusion,10,57.4,59.7,33.3
35,98,10,61,20,72,30,50,1,0.5,1,Phusion,10,96.5,82.8,45
35,98,10,65,20,72,30,50,1,0.5,1,Phusion,10,102.5,88.2,45
35,98,8,65,20,72,30,50,1,0.5,1,Phusion,10,86.1,79.3,43.8
35,98,10,65,20,72,30,50,1,0.5,1,Phusion,10,98.9,86.3,45
35,98,10,65,20,72,30,50,1,0.5,1,Phusion,10,90,83.5,45
35,98,10,65,25,72,30,50,1,0.5,1,Phusion,10,106.3,89.8,47.9
35,98,10,65,25,72,30,50,1,0.5,1,Phusion,10,106.6,88.6,47.9
35,98,10,65,25,72,30,10,2.5,1,1,Phusion,10,196.3,76.5,47.9
35,98,10,65,25,72,30,50,2.5,1,1,Phusion,10,177.7,71.9,47.9
35,98,10,65,25,72,30,50,1,1,1,Phusion,10,124.2,96.8,47.9
35,98,10,65,25,72,30,50,1,1,1,Phusion,10,120.7,96.6,47.9
35,98,10,65,25,72,30,50,1,1,1,Phusion,10,121.9,97.1,47.9
25,98,10,58,25,72,30,50,1,1,1,Phusion,10,118.8,96.7,37.1
25,98,10,58,25,72,30,50,1,1,1,Phusion,10,122.2,97,37.1
25,98,10,58,25,72,30,50,1,1,1,Phusion,10,116.4,96.8,37.1
25,98,10,68,25,72,30,50,1,1,1,Phusion,10,67.8,77,37.1
25,98,10,68,25,72,30,50,1,1,1,Phusion,10,67.3,76.6,37.1
25,98,10,68,25,72,30,50,1,1,1,Phusion,10,73.9,78.9,37.1
35,98,10,58,25,72,30,50,1,1,1,Phusion,10,118.4,96.4,47.9
35,98,10,58,25,72,30,50,1,1,1,Phusion,10,119.8,96.8,47.9
35,98,10,58,25,72,30,50,1,1,1,Phusion,10,119.2,97,47.9
35,98,10,68,25,72,30,50,1,1,1,Phusion,10,107.8,91.7,47.9
35,98,10,68,25,72,30,50,1,1,1,Phusion,10,109,92.4,47.9
35,98,10,68,25,72,30,50,1,1,1,Phusion,10,111.5,93.2,47.9
25,98,10,61,25,72,30,50,1,1,1,Phusion,10,115.8,95.8,37.1
25,98,10,61,25,72,30,50,1,1,1,Phusion,10,119,96.9,37.1
25,98,10,61,25,72,30,50,1,1,1,Phusion,10,121.1,97,37.1
35,98,10,61,25,72,30,50,1,1,1,Phusion,10,121.4,96.9,47.9
35,98,10,61,25,72,30,50,1,1,1,Phusion,10,118.5,97,47.9
35,98,10,61,25,72,30,50,1,1,1,Phusion,10,120.7,96.9,47.9

3_question/readme.md

## 3. Explore PCR planning with the virtual simulator

2. Familiarise yourself with the controls and with the meanings of DNA yield and purity. Run a baseline reaction and record every setting and both outputs.
- the baseline reaction gives us 0.1ql yield and 10.5% purity.
- If we only change the polymerase from Taq to Phusion, we immediately get 0.2 yield, and 13.4% purity. This is the first adjustable factor we are changing (does it count?)
- then we can change the amount of cycles. now it is 15. If we move it to 35 (with every other thing intact), we get 1.2 yield, with 34.5% purity. Let's test this with low value (low amount of cycles, 5): it gives us 0.0 yield, and 7.4% purity. What about a high number (let's do 50)? It gave us 3.3 yield, and 52.4% of purity. Which is already much better.
- But what if the second condition is annealing temperature? We can calculate the annealing temperature required for the reaction, using NEB Tm calculator.
- We can calculate the final primer concentration using c1v1=c2v2. But the simulator does not specify the volume we are using (the final volume for the reaction). Therefore, we are going to assume it is 50ql, because that is what 1 unit of Phusion polymerase is going to work the best with.
- therefore, c1v1=c2v2 will give us: 10qlx1ql/50ql = 0.2qm = 200nM for each primer. This is a bit lower than NEBs recommendation for Phusion, which would be 0.5qM (500nM) for each primer. Since we can only change two parameters, we cannot really change it. Primer concentration is a variable we still need to check and optimise for real reactions.
- After putting this information (Phusion, 200nM) in NEB Tm calculator, we get the annealing temperature of 61C. So now, we are gonna check all of the settings the same as default (including no of cycles at 15) and only change the annealing C to 61 instead of 68.
- original parameters gave us 0.2 yield, and purity of 14.1%. Now lets check this with annealing temp at 45 (low) - this gives us 0.2 yield, and 12.9% purity;
- now with high annealing temperature: lets use 79 (basically denaturation). Surprisingly, we got purity of 14.8% and yield of 0.3
- lets try with 35 cycles and annealing temp of 61. This gives us 1.3 yield and 35.7% purity.
- that is two conditions done. But how to maximize the yield and purity? Let's look at NEB Phusion parameters (online), this is what it suggests for 50ql reaction:
  -  10ql phusion buffer;
  -  1ql 10dM dNTPs;
  -  2.5ql 10qL F/R primers;
  -  variable template amount;
  -  0.5ql phusion DNA polymerase
- Thermocycling:
  - 25-35 cycles:
    - 98C for 5-10 seconds;
    - 42-72C for 10-30 seconds;
    - 72C for 15-39 seconds/kb.
If we wanted to maximize the yield and purity for our reaction, we should increase teh thermocycling temperatures accordingly (the extension temperature now is too low). If we move extension temperature to 72 and annealing to 61, but keep cycles at 15, we still get 0.2 yield and 13.5 purity. If we increase the numebr of cycles to 35, we then get 1.2 yield, with 34.2% purity.
Let's change the timings: annealing lets put 20 seconds, extension lets leave on 20 (no of cycles 35, denaturation at 80, annealing at 61, extension at 72). This now gives us 2.1 yield, and 46.2% of purity.
lets also change denaturation (on top of everything) to 98. AHA! This si giving us yield of 95.0, and purity of 81.8%. Let's lower annealing time to 10 seconds. this moved this down to 57.4 yield and 59.7% purity.
okay, then lets do annealing at 20 and extension at 30 seconds. this gives us 96.5 yield, and 82.8% purity.
If we change annealing temp tp 65 (from 61), we get: 102.5 yield and 88.2% purity.
if on top of that we change denaturation to 8 sec instead of 10, we get: 86.1 and 79.3% purity.

SO far the best results we have are: 35 cycles; denaturation at 98 for 10, annealing at 65 for 20, extension at 72 for 30. The results change every time we run the simulation (?)
if we increase annealing time to 25 secs, we get 106.2 yield with 89.8% purity.

We have a new baseline now, these are the parameters: 
no cycles 35; denaturation at 98 for 10, annealing at 65 for 25, extension at 72 for 30. each dNTP is 1ql, each rpimer is 1ql, plasmid is at 50ng, polymerase at 1U (phusion). 
We have done 3 runs, with the following yield and purity: 124.2, 96.8%; 120.7, 96.6%; 121.9, 97.1%. In total, this gives us a mean +- SD of 122.3+-1.8 (yield) and 96.8+-0.3 purity.

For 2x2 we can use cycles and annealing temperature, with everything else at the baseline. 3 reps each:
Condition A: 25 cycles (low), 58 annealing (low): 118.8 yield, 96.7% purity; 122.2 yield, 97% purity; 116.4 yield, 96.8% purity. 
condition B: 25 cycles, 68 annealing (high): 67.8 yield, 77% purity; 67.3 yield, 76.6% purity; 73.9 yield, 78.9% purity. 
condition C: 35 cycles (high), 58 annealing: 118.4, 96.4%; 119.8, 96.8%; 119.2,  97.0%. 
condition D: 35 cycles, 68 annealing: 107.8, 91.7%; 109.0, 92.4%; 111.5, 93.2%. 
Condition E: 25 cycles, 61 annealing: 115.8, 95.8%; 119.0, 96.9%; 121.1, 97.0%. 
Condition F: 35 cycles, 61 annealing: 121.4, 96.9%; 118.5, 97.0%; 120.7, 96.9%.